direction,relation,relex_relcos,sentence,term1,term2
SPONTANEOUS ADRENAL HEMORRHAGE causes NEUROBLASTOMA,causes,0.680413817439772,"Less commonly, in newborns, SPONTANEOUS ADRENAL HEMORRHAGE may produce large adrenal masses, simulating NEUROBLASTOMA or Wilms' tumor.",SPONTANEOUS ADRENAL HEMORRHAGE,NEUROBLASTOMA
CLOZAPINE treats SCHIZOPHRENIA,treats,1.0,"Atypical antipsychotic drugs (APDs) such as CLOZAPINE but not the typical APD haloperidol, improve some aspects of cognition in SCHIZOPHRENIA",SCHIZOPHRENIA,CLOZAPINE
IMMEDIATE RELEASE LEVODOPA treats PD,treats,0.8660254037844392,STUDY SELECTION  English language studies were selected if they evaluated the neuroprotective effects or safety of selegiline or if they compared dopamine agonists with levodopa or sustained release levodopa with IMMEDIATE RELEASE LEVODOPA in previously untreated patients with PD,PD,IMMEDIATE RELEASE LEVODOPA
BCL 2 GENE causes FOLLICULAR LYMPHOMAS,causes,0.462910049886276,"This growth enhancement was also seen in cells transfected with the BCL 2 gene with its own promoter juxtaposed to the immunoglobulin heavy chain gene enhancer, which represents the translocated form of the BCL 2 GENE observed in FOLLICULAR LYMPHOMAS with the t(14;18) translocation.",FOLLICULAR LYMPHOMAS,BCL 2 GENE
S PANAMA BACTEREMIA treats BACTERIA,treats,0.3651483716701111,"As to bacteriological efficacy, BACTERIA were reduced in the case with S PANAMA BACTEREMIA while they were eradicated within 2 to 5 days after CTRX administration in 2 cases with acute urinary tract infections and 1 with recurrent urinary tract infection, both caused with E. coli, and in 1 with acute urinary tract infection with P. mirabilis.",BACTERIA,S PANAMA BACTEREMIA
DISOPYRAMIDE treats VENTRICULAR TACHYCARDIA,treats,0.50709255283711,"In 75% of supraventricular parossistic tachycardia and in 75% of parossistic atrial fibrillation, arrhythmia was interrupted within few minutes from drug injection; in 90% with premature ventricular contractions (PVC) and in 100% of VENTRICULAR TACHYCARDIA DISOPYRAMIDE was capable to interrupt the arrhythmias.",VENTRICULAR TACHYCARDIA,DISOPYRAMIDE
ASCITES location HEPATOMA,location,0.78086880944303,The activities of nucleoside diphosphatase in various rat ASCITES cells of HEPATOMA and fetal and neonatal rat liver were much lower than that of normal adult rat liver.,ASCITES,HEPATOMA
ANTIARRHYTHMIC DRUG EFFICACY treats ARRHYTHMIAS,treats,0.7624928516630229,While maximal exercise testing is useful for detection of arrhythmias and assessment of ANTIARRHYTHMIC DRUG EFFICACY few reports have documented the safety of this procedure in patients with malignant ventricular ARRHYTHMIAS.,ARRHYTHMIAS,ANTIARRHYTHMIC DRUG EFFICACY
no_relation,causes,0.529812942826018,The classic histologic presentation of epidermodysplasia verruciformis is a VERRUCA PLANA TYPE LESION with minimal HYPERKERATOSIS and acanthotic areas where the cells contain perinuclear halos and blue gray pallor.,HYPERKERATOSIS,VERRUCA PLANA TYPE LESION
no_relation,causes,0.31622776601683805,Effects of enalapril on mortality in severe CONGESTIVE HEART FAILURE: results of the cooperative North Scandinavian ENALAPRIL survival study (consensus.,CONGESTIVE HEART FAILURE,ENALAPRIL
no_relation,causes,0.34188172937891403,RISPERIDONE is an atypical antipsychotic agent with efficacy for both positive and negative symptoms of SCHIZOPHRENIA,SCHIZOPHRENIA,RISPERIDONE
ORAL METRONIDAZOLE AND TOPICAL CLINDAMYCIN treats BACTERIAL VAGINOSIS,treats,0.9838699100999068,"Sobel JD, Schmitt C, Meriwether C. Long term follow up of patients with BACTERIAL VAGINOSIS treated with ORAL METRONIDAZOLE AND TOPICAL CLINDAMYCIN.",BACTERIAL VAGINOSIS,ORAL METRONIDAZOLE AND TOPICAL CLINDAMYCIN
no_relation,causes,0.547722557505166,"However, despite the additional information provided by MRI, mammography is still an extremely important diagnostic imaging modality, particularly for several common conditions such as ductal carcinoma IN SITU (DCIS) where it has been shown that there is a strong correlation between MICROCALCIFICATION CLUSTERS and malignancy.",MICROCALCIFICATION CLUSTERS,IN SITU (DCIS
PHP IA causes ALBRIGHT HEREDITARY OSTEODYSTROPHY (AHO),causes,0.963086824686154,"Patients with PHP IA exhibit a complex of somatic abnormalities, termed ALBRIGHT HEREDITARY OSTEODYSTROPHY (AHO).",ALBRIGHT HEREDITARY OSTEODYSTROPHY (AHO),PHP IA
EPILEPSY causes SEIZURE,causes,0.937042571331636,Treatment with antiepileptic drugs (AED) increases the chance of SEIZURE control in patients with EPILEPSY,SEIZURE,EPILEPSY
MYASTHENIA GRAVIS diagnosis EDROPHONIUM (TENSILON) TEST,diagnosis,1.0,A bedside EDROPHONIUM (TENSILON) TEST in our emergency department confirmed the diagnosis of MYASTHENIA GRAVIS,MYASTHENIA GRAVIS,EDROPHONIUM (TENSILON) TEST
NICOTINE causes NICOTINE DEPENDENCE,causes,0.975900072948533,An affective model suggests that NICOTINE DEPENDENCE should be related to an individual's tendency to experience negative affect and expectations that NICOTINE use would ameliorate such affect.,NICOTINE,NICOTINE DEPENDENCE
ENDOMETRIOSIS causes PAIN,causes,0.99654575824488,The problem is determining when the PAIN is caused by ENDOMETRIOSIS,PAIN,ENDOMETRIOSIS
PART OF WAGR SYNDROME causes MILD TO MODERATE INTELLECTUAL DISABILITY,causes,0.737209780774486,"Although MILD TO MODERATE INTELLECTUAL DISABILITY is usually considered PART OF WAGR SYNDROME (Wilms' tumour (WT), Aniridia, Genital abnormalities, and metal Retardation, due to 11p13 deletion) the neuropsychological profile of the syndrome is little reported in the literature.",MILD TO MODERATE INTELLECTUAL DISABILITY,PART OF WAGR SYNDROME
VIRUS ASSOCIATED HEMOPHAGOCYTIC SYNDROME (VAHS) causes HEMOPHAGOCYTOSIS,causes,0.8616404368553291,"A VIRUS ASSOCIATED HEMOPHAGOCYTIC SYNDROME (VAHS) is a non neoplastic, generalized histiocytic proliferation with prominent HEMOPHAGOCYTOSIS associated with a systemic viral infection.",HEMOPHAGOCYTOSIS,VIRUS ASSOCIATED HEMOPHAGOCYTIC SYNDROME (VAHS)
ADRENAL PHEOCHROMOCYTOMA causes PERIODIC ALTERNATING HYPERTENSION,causes,0.843274042711568,We present a patient with an ADRENAL PHEOCHROMOCYTOMA with an unusual pattern of PERIODIC ALTERNATING HYPERTENSION and hypotension.,PERIODIC ALTERNATING HYPERTENSION,ADRENAL PHEOCHROMOCYTOMA
CRANIOCEREBRAL TRAUMA causes POSTTRAUMATIC EPILEPSY,causes,0.8006407690254359,It also allowed to predict the development of POSTTRAUMATIC EPILEPSY in individuals with CRANIOCEREBRAL TRAUMA in the past.,POSTTRAUMATIC EPILEPSY,CRANIOCEREBRAL TRAUMA
no_relation,treats,0.4574957109978139,"The diagnosis of PLASMA CELL LEUKAEMIA a rare disorder with an AGGRESSIVE CLINICAL COURSE and poor prognosis, is not always straightforward and may be dependent on the results of immunophenotyping.",AGGRESSIVE CLINICAL COURSE,PLASMA CELL LEUKAEMIA
STOMACH location GASTRIC CARCINOMA,location,0.984731927834662,"Applications of endoscopic US in the STOMACH include staging of GASTRIC CARCINOMA localization and characterization of nonmucosal gastric masses, detection and evaluation of gastric varices, and evaluation of gastric lymphoma.",STOMACH,GASTRIC CARCINOMA
no_relation,causes,0.855186110494136,Fetal warfarin syndrome (FWS) or warfarin (coumadin) embryopathy is a rare condition as a result of fetal exposure to maternal ingestion of WARFARIN during PREGNANCY,WARFARIN,PREGNANCY
no_relation,treats,0.437594974493684,"Identification of more LQTS mutations in SIDS cases could provide new insights into the pathophysiology of SIDS and, consequently, reduce the number of unexplained SUDDEN INFANT DEATHS",SIDS,SUDDEN INFANT DEATHS
ALL TRANS RETINOIC ACID (ATRA) treats ACUTE PROMYELOCYTIC LEUKEMIA (APL),treats,1.0,ALL TRANS RETINOIC ACID (ATRA) is the drug of choice for the treatment of ACUTE PROMYELOCYTIC LEUKEMIA (APL),ACUTE PROMYELOCYTIC LEUKEMIA (APL),ALL TRANS RETINOIC ACID (ATRA)
IVIG treats IDIOPATHIC THROMBOCYTOPENIC PURPURA,treats,0.8846517369293829,"Indications for IVIG therapy were IDIOPATHIC THROMBOCYTOPENIC PURPURA (ITP) in six patients and hypogammaglobulinemia in 7 patients with various hematologic disorders, who were defined immunodeficient (ID.",IDIOPATHIC THROMBOCYTOPENIC PURPURA,IVIG
no_relation,causes,0.5,This case fulfills all the criteria of an MMMT in having a carcinomatous and a SARCOMATOUS COMPONENT but differs from cases of MMMT in women in that the sarcomatous component had decidualized.,SARCOMATOUS COMPONENT,MMMT
no_relation,treats,0.875189948987367,"Overall, they can be divided into: a) medications that act on the inflammatory response triggered by ischemia/reperfusion, such as anti CD11/CD18 antibodies and anti complement, and b) MEDICATIONS that enhance metabolic TOLERANCE such as glucose insulin potassium solution and inhibitors of the Na+/H+ ion exchange system.",MEDICATIONS,TOLERANCE
no_relation,treats,0.753778361444409,"Convalescent phase sera from patients with HEMORRHAGIC FEVER WITH RENAL SYNDROME (HFRS) having higher IF antibody titers to Hantaan virus than to nephropathia epidemica (NE) virus were capable of neutralizing HANTAAN VIRUS, while sera from patients with higher IF antibody titers to NE virus than Hantaan virus did not contain neutralizing antibody to Hantaan virus.",HANTAAN VIRUS,HEMORRHAGIC FEVER WITH RENAL SYNDROME
METHACHOLINE treats BRONCHIAL HYPERREACTIVITY,treats,0.8955334711889901,We found that active pulmonary tuberculosis would increase the nonspecific bronchial response with METHACHOLINE and the mechanism of the BRONCHIAL HYPERREACTIVITY in patients with active pulmonary tuberculosis may not be related to an immunologic mechanism but may be related to the stimulating receptors.,BRONCHIAL HYPERREACTIVITY,METHACHOLINE
ABSENCE EPILEPSY causes SEIZURES,causes,0.8867963503478641,"The final form of ABSENCE EPILEPSY is epilepsy with myoclonic absences, a rare disorder with a specific form of absence SEIZURES",SEIZURES,ABSENCE EPILEPSY
no_relation,causes,0.38490017945975,"The atopic diseases of childhood consist of the triad of ASTHMA allergic rhinitis, and ATOPIC DERMATITIS",ASTHMA,ATOPIC DERMATITIS
TRICHURIS TRICHIURA causes TRICHURIASIS,causes,0.985329278164293,9  Trichuriasis  Treatment of TRICHURIASIS   +    caused by  TRICHURIS TRICHIURA  (whipworm.,TRICHURIS TRICHIURA,TRICHURIASIS
no_relation,causes,0.566138517072298,"Varicella zoster virus (VZV) is the herpesvirus which causes the childhood disease VARICELLA also known as CHICKENPOX and the adult disease herpes zoster, also known as shingles.",VARICELLA,CHICKENPOX
RILUZOLE treats AMYOTROPHIC LATERAL SCLEROSIS,treats,0.943456353049726,RILUZOLE for AMYOTROPHIC LATERAL SCLEROSIS (ALS)/motor neuron disease (MND.,AMYOTROPHIC LATERAL SCLEROSIS,RILUZOLE
TRICYCLIC ANTIDEPRESSANTS treats DEPRESSION,treats,0.981980506061966,"Other disorders, along with the migraine medications that may be effective against them, include epilepsy (divalproex sodium, topiramate, and gabapentin), hypertension (beta blockers), DEPRESSION (TRICYCLIC ANTIDEPRESSANTS venlafaxine), bipolar disorder (divalproex sodium), insomnia (tricyclic antidepressants), essential tremor (beta blockers and topiramate), and overweight or obesity (topiramate.",DEPRESSION,TRICYCLIC ANTIDEPRESSANTS
BONE MARROW location MYELOGENOUS LEUKEMIA,location,0.848528137423857,This study shows that both recombinant human interleukin (rhIL)3 and rhIL4 induced proliferation in BONE MARROW (BM) cells of MYELOGENOUS LEUKEMIA patients in a manner similar to that reported using normal BM cells.,BONE MARROW,MYELOGENOUS LEUKEMIA
CHRONIC DIARRHEA causes LOOSE STOOLS,causes,0.9354143466934848,CHRONIC DIARRHEA can be defined as the passage of more than 3 LOOSE STOOLS per day during more than 4 weeks.,LOOSE STOOLS,CHRONIC DIARRHEA
VIRUS causes VIRAL INFECTION,causes,0.848874687627165,We apply well established principles of modelling VIRUS dynamics to the study of chronic VIRAL INFECTION demonstrating that a model which incorporates the distinct contributions of cytotoxic T lymphocytes (CTLs) and antibodies exhibits long periods of quiescence followed by brief bursts of viral production.,VIRUS,VIRAL INFECTION
BLISTERING SKIN DISEASE PEMPHIGUS causes SKIN WOUNDS,causes,0.790569415042095,The activation of the urokinase system has been observed during re epithelialization of SKIN WOUNDS and in lesions of the autoimmune BLISTERING SKIN DISEASE PEMPHIGUS,SKIN WOUNDS,BLISTERING SKIN DISEASE PEMPHIGUS
no_relation,treats,0.480384461415261,The robust neuroendocrine counterregulatory responses induced by hypoglycemia protect the brain by restoring PLASMA GLUCOSE but little is known about molecular responses to HYPOGLYCEMIA that may also be neuroprotective.,HYPOGLYCEMIA,PLASMA GLUCOSE
no_relation,causes,0.707106781186547,"2]  Kastelein JJ, Akdim F, Stroes ES, Zwinderman AH, Bots ML, Stalenhoef AF, et al. Simvastatin with or without EZETIMIBE in FAMILIAL HYPERCHOLESTEROLEMIA",FAMILIAL HYPERCHOLESTEROLEMIA,EZETIMIBE
PHEOCHROMOCYTOMA causes HYPERTENSION,causes,0.948683298050514,Evidence: ? Patients with identifiable causes of HYPERTENSION such as PHEOCHROMOCYTOMA and renal disease have unique perioperative considerations ( 12.,HYPERTENSION,PHEOCHROMOCYTOMA
ACEBUTOLOL treats HYPERTENSION,treats,1.0,Aldactone and ACEBUTOLOL in treatment of HYPERTENSION,HYPERTENSION,ACEBUTOLOL
no_relation,causes,0.3651483716701111,"Depending on video EEG recordings and witnessed accounts, 18 of the patients had no seizures recorded, 160 had epileptic seizures and 18 had PSYCHOGENIC NON EPILEPTIC SEIZURES four of whom had psychogenic non epileptic seizures plus true EPILEPTIC SEIZURES",PSYCHOGENIC NON EPILEPTIC SEIZURES,EPILEPTIC SEIZURES
ANTIPYRINE treats EAR PAIN (OTALGIA EARACHE,treats,1.0,"r  Otic Pain  Used alone or in fixed combination with ANTIPYRINE for the temporary relief of EAR PAIN (OTALGIA EARACHE associated with otitis media of various causes; however, single ingredient preparations no longer commercially available in the US.",EAR PAIN (OTALGIA EARACHE,ANTIPYRINE
LOW MOLECULAR WEIGHT HEPARIN treats RECURRENT VENOUS THROMBOEMBOLISM,treats,0.993883734673619,LOW MOLECULAR WEIGHT HEPARIN versus a coumarin for the prevention of RECURRENT VENOUS THROMBOEMBOLISM in patients with cancer.,RECURRENT VENOUS THROMBOEMBOLISM,LOW MOLECULAR WEIGHT HEPARIN
L DOPA treats PARKINSON'S DISEASE,treats,0.9918365981341758,"The drug L Dopa is used in the treatment of PARKINSON'S DISEASE (PD), and patients often experience fluctuations in performance after a period of time taking L DOPA.",PARKINSON'S DISEASE,L DOPA
GRAM NEGATIVE SEPSIS causes SYSTEMIC INFLAMMATORY RESPONSE SYNDROME,causes,0.99654575824488,"During GRAM NEGATIVE SEPSIS endotoxin lipopolysaccharide (LPS) may activate host inflammatory responses, resulting in the SYSTEMIC INFLAMMATORY RESPONSE SYNDROME and the adult respiratory distress syndrome.",SYSTEMIC INFLAMMATORY RESPONSE SYNDROME,GRAM NEGATIVE SEPSIS
PROPOFOL treats REFRACTORY STATUS EPILEPTICUS,treats,0.995893206467704,"Treatment of REFRACTORY STATUS EPILEPTICUS with pentobarbital, PROPOFOL or midazolam: a systematic review.",REFRACTORY STATUS EPILEPTICUS,PROPOFOL
IMMUNOSUPPRESSIVE MEDICATIONS causes DRUG SIDE EFFECTS,causes,0.903696114115064,"? An infectious disease specialist for management of prophylactic antibiotic therapy and concomitant infections due to Wegener's granulomatosis or IMMUNOSUPPRESSIVE MEDICATIONS ? An ophthalmologist for ocular involvement and to monitor for DRUG SIDE EFFECTS such as cataracts from prednisone ? A neurologist for management of new neurologic complications ? Physical and occupational therapists to improve strength and function in patients with vasculitis and neurologic complications  Rationale: ? Organ specific specialists in fields such as otolaryngology, pulmonology, dermatology, neurology, and nephrology should be consulted depending on the nature and severity of end.",IMMUNOSUPPRESSIVE MEDICATIONS,DRUG SIDE EFFECTS
BRANCHING (CASTING TYPE CALCIFICATIONS causes DCIS,causes,0.956182887467515,Multiple calcifications occurred in the necrotic core of the continuous DCIS resulting in linear and BRANCHING (CASTING TYPE CALCIFICATIONS a hallmark of high grade DCIS on mammograms.,BRANCHING (CASTING TYPE CALCIFICATIONS,DCIS
no_relation,treats,0.696310623822791,Lieberman A. Long term experience with selegiline and LEVODOPA in PARKINSON'S DISEASE,PARKINSON'S DISEASE,LEVODOPA
no_relation,diagnosis,0.387298334620742,We collected resource use data prospectively for 930 patients alongside a multinational trial of ZOLEDRONIC ACID versus pamidronate for patients with METASTATIC MULTIPLE MYELOMA or breast cancer and > or =1 bone lesion.,METASTATIC MULTIPLE MYELOMA,ZOLEDRONIC ACID
no_relation,causes,0.560112033611204,The evidence reviewed here supports the hypothesis that metal catalyzed oxidation reactions occur in the lens and may make a significant contribution to the changes seen in the LENS with age and in CATARACT FORMATION.,LENS,CATARACT FORMATION
MALT LYMPHOMAS causes LYMPHOEPITHELIAL LESIONS,causes,0.629940788348712,High grade lymphomas were classified in three groups based on the presence or absence of a low grade component and LYMPHOEPITHELIAL LESIONS (LELs): 1) high grade MALT lymphomas appearing in low grade MALT LYMPHOMAS (LG/HG MALT lymphoma); 2) large cell lymphoma with LELs composed of large cells (high grade LELs) but without a low grade component (HG MALT lymphoma); and 3) diffuse large cell lymphoma without a low grade MALT lymphoma component or LELs (DLCL.,LYMPHOEPITHELIAL LESIONS,MALT LYMPHOMAS
PARACETAMOL treats PAIN,treats,0.997054485501582,Measles patients with an acute ear infection should receive PARACETAMOL for PAIN and fever and an antibiotic for the infection.,PAIN,PARACETAMOL
COMPLEX FEBRILE SEIZURES causes EPILEPSY,causes,0.9438798074485388,"B]  Specific recommendation: ? Tell parents and caretakers that: ? The risk of developing epilepsy after a simple febrile seizure is small and is only slightly greater than the background risk in the population ? The following factors place the child at a higher risk for the development of epilepsy: ? Previous neurologic abnormality ? COMPLEX FEBRILE SEIZURES ? Family history of epilepsy ? Recurrent febrile seizures  Rationale: ? Development of EPILEPSY is another major concern that families often have, and it can be difficult to assess the risk of epilepsy on an.",COMPLEX FEBRILE SEIZURES,EPILEPSY
QUINIDINE treats VENTRICULAR TACHYCARDIA (VT),treats,0.9838699100999068,The efficacy of mexiletine and QUINIDINE in controlling ventricular couplets (VC) and VENTRICULAR TACHYCARDIA (VT) was compared in 156 trials (78 for each drug) in 114 consecutive patients.,VENTRICULAR TACHYCARDIA (VT),QUINIDINE
TYPE A BOTULINUM TOXIN treats BLEPHAROSPASM,treats,0.9950371902099888,Treatment with TYPE A BOTULINUM TOXIN appears to be a safe and effective means of temporarily relieving BLEPHAROSPASM,BLEPHAROSPASM,TYPE A BOTULINUM TOXIN
SKIN location GENERALIZED HIVES,location,0.9830783046228492,"Acute onset of an illness (over minutes to several hours) involving the SKIN mucosal tissue, or both (e.g., GENERALIZED HIVES; pruritus or flushing; swollen lips, tongue, or uvula) and at least one of the following:  a.",SKIN,GENERALIZED HIVES
no_relation,causes,0.6868028197434449,"CENTRAL NERVOUS SYSTEM (CNS) embryonal tumors are devastating cancers in children, consisting of MEDULLOBLASTOMAS CNS primitive neuroectodermal tumors, and atypical teratoid/rhabdoid tumors.",CENTRAL NERVOUS SYSTEM,MEDULLOBLASTOMAS
CEREBELLUM location CEREBELLAR ATAXIA,location,0.855186110494136,The laterality of CEREBELLAR ATAXIA was significantly correlated with AI in the CEREBELLUM in patients with sOPCA.,CEREBELLUM,CEREBELLAR ATAXIA
FLUORIDE treats DENTAL CARIES,treats,0.994134846772434,This paper reviews the probable mechanism of DENTAL CARIES and the role of FLUORIDE in the inhibition or reversal of that process.,DENTAL CARIES,FLUORIDE
BREAST EPITHELIAL STEM CELLS location BREAST CANCER,location,0.9494253265550828,BREAST EPITHELIAL STEM CELLS are thought to be the primary targets in the aetiology of BREAST CANCER,BREAST EPITHELIAL STEM CELLS,BREAST CANCER
PROPRANOLOL treats HYPERTENSION,treats,0.963086824686154,"van Schaik BAM, Geyskes GG, Kettner N et al. Comparison of enalapril and PROPRANOLOL in essential HYPERTENSION",HYPERTENSION,PROPRANOLOL
no_relation,causes,0.943456353049726,SELENIUM (SE) DEFICIENCY is said to contribute to the atrophy of the thyroid gland in certain ENDEMIC GOITER areas in Africa.,ENDEMIC GOITER,SELENIUM (SE) DEFICIENCY
PRINZMETAL VARIANT ANGINA diagnosis ERGOMETRINE,diagnosis,0.970142500145332,"ERGOMETRINE is currently used as a test for PRINZMETAL VARIANT ANGINA causing specifically a coronary artery spasm in these patients, even if the mechanism of this drug on coronaries is still unclear.",PRINZMETAL VARIANT ANGINA,ERGOMETRINE
no_relation,causes,0.7293249574894731,Genetic ablation of the chromogranin A (Chga) gene in mice increases blood pressure and pretreatment of Chga null mice with Cts prevents BLOOD PRESSURE ELEVATION indicating a direct role of Cts in preventing HYPERTENSION,BLOOD PRESSURE ELEVATION,HYPERTENSION
no_relation,causes,0.314485451016576,"Microscopic examination of the resected specimen revealed a MALIGNANT MELANOMA which was confirmed by immunohistochemical staining for HMB 45, S 100 protein, MELANOMA PAN and vimentin.",MELANOMA PAN,MALIGNANT MELANOMA
ERGONOVINE causes VASOSPASTIC ANGINA PECTORIS,causes,0.9578262852211508,"For clarification of the characteristic features of ventricular arrhythmias during acute myocardial ischemia, ventricular arrhythmias were studied in 81 patients with VASOSPASTIC ANGINA PECTORIS induced by ERGONOVINE",VASOSPASTIC ANGINA PECTORIS,ERGONOVINE
FLUORIDES treats CARIES,treats,0.953462589245592,In the past the inhibition of CARIES by FLUORIDES was ascribed to the reduced solubility of enamel due to the incorporation of F  into the enamel mineral.,CARIES,FLUORIDES
DOG HYPERSENSITIVITY causes DOG HYPERSENSITIVITY SYMPTOMS,causes,0.964763821237732,"However, the children who were exposed to a dog at home during early childhood developed DOG HYPERSENSITIVITY SYMPTOMS significantly earlier and had DOG HYPERSENSITIVITY slightly more often than the subjects with a later exposure or no exposure to dog.",DOG HYPERSENSITIVITY SYMPTOMS,DOG HYPERSENSITIVITY
GRADED PORTAL VEIN STENOSIS causes PORTAL HYPERTENSION,causes,0.970494958830946,PORTAL HYPERTENSION was induced by GRADED PORTAL VEIN STENOSIS whereas controls had a sham operation.,GRADED PORTAL VEIN STENOSIS,PORTAL HYPERTENSION
DIABETIC KETOACIDOSIS causes DIABETES MELLITUS,causes,0.609994281330419,Rationale: ? A significant number of new cases of DIABETES MELLITUS begin as DIABETIC KETOACIDOSIS,DIABETIC KETOACIDOSIS,DIABETES MELLITUS
no_relation,causes,0.338061701891407,Our observations and descriptions in the literature indicate that the presence and degrees of AMYLOID DEPOSITION in the skeletal muscles would be related to the types of amyloid proteins in AMYLOIDOSIS,AMYLOID DEPOSITION,AMYLOIDOSIS
LATENT HYPERCORTISOLISM diagnosis DEXAMETHASONE,diagnosis,0.99654575824488,"The crucial points of the French consensus are: the usefulness of CT scanning evaluation of adrenal incidentalomas, the systematic screening for pheochromocytoma, the usefulness of the 1mg overnight DEXAMETHASONE test to screen for LATENT HYPERCORTISOLISM the difficulty to interpret mild biological abnormalities of the HPA axis, the consensus to remove surgically most of tumours greater than 4cm, the necessity to follow clinically glucorticoid tissular targets in the follow up of non operated benign adrenocortical incidentalomas.",LATENT HYPERCORTISOLISM,DEXAMETHASONE
BLADDER location BLADDER INJURY,location,1.0,Intraperitoneal rupture usually involves the bladder dome; it often occurs when the bladder is distended at the time of trauma and is the most common BLADDER INJURY in children because the BLADDER lies in the abdomen.,BLADDER,BLADDER INJURY
ENDOMETRIAL CANCER diagnosis POSTMENOPAUSAL BLEEDING,causes,0.707106781186547,? A prospective study was done to evaluate the role of three dimensional vs. two dimensional TVUS in diagnosing ENDOMETRIAL CANCER in patients with a history of POSTMENOPAUSAL BLEEDING,POSTMENOPAUSAL BLEEDING,ENDOMETRIAL CANCER
HYPERTHERMIA treats HEPATOCELLULAR CARCINOMA,treats,0.9578262852211508,"In view of acceptable toxicities and the current rate of survival, further evaluation of combined treatment of radiotherapy and HYPERTHERMIA for unresectable HEPATOCELLULAR CARCINOMA is warranted.",HYPERTHERMIA,HEPATOCELLULAR CARCINOMA
RISPERIDONE treats DEMENTIA,treats,0.997054485501582,"1]  Brodaty H, Ames D, Snowdon J, Woodward M, Kirwan J, Clarnette R, et al A randomized placebo controlled trial of RISPERIDONE for the treatment of aggression, agitation, and psychosis of DEMENTIA",DEMENTIA,RISPERIDONE
ERGONOVINE treats VARIANT ANGINA PECTORIS,treats,0.9594032236002472,Transient prolongation of the corrected Q T interval preceded spontaneous or ergonovine maleate provoked coronary spasm in 11 patients with VARIANT ANGINA PECTORIS whereas no significant change in the Q T interval followed ERGONOVINE administration in 27 control patients with atypical chest pain who did not have coronary spasm.,VARIANT ANGINA PECTORIS,ERGONOVINE
no_relation,location,0.508000508000762,Because histologically prominent MICROVASCULAR PROLIFERATION is frequently present in GLIOBLASTOMA MULTIFORME it has been hypothesized that this neoplasm is particularly dependent on neovascularization for its continued growth and that antiangiogenic therapy might be especially useful.,MICROVASCULAR PROLIFERATION,GLIOBLASTOMA MULTIFORME
no_relation,treats,0.4472135954999579,"If the oxygen is too low, the incidence of DECOMPRESSION SICKNESS increases; if the OXYGEN is too high, oxygen poisoning becomes a problem.",DECOMPRESSION SICKNESS,OXYGEN
