direction,relation,relex_relcos,sentence,term1,term2
FEBRILE RESPIRATORY ILLNESS causes INFLUENZA,causes,0.781133465884943,"INFLUENZA activity in the community is marked by increased medical contacts for FEBRILE RESPIRATORY ILLNESS increased absenteeism from school and the workplace, subsequent increased hospitalizations for pneumonia and other cardiopulmonary disorders, and increased mortality.",INFLUENZA,FEBRILE RESPIRATORY ILLNESS
no_relation,causes,0.522232967867094,"Boccardo F, Rubagotti A, Canobbio L et al. Interleukin 2, interferon alpha and INTERLEUKIN 2 PLUS INTERFERON ALPHA in RENAL CELL CARCINOMA",RENAL CELL CARCINOMA,INTERLEUKIN 2 PLUS INTERFERON ALPHA
no_relation,causes,0.9931270663228408,INFECTIOUS MONONUCLEOSIS presenting as SPONTANEOUS SPLENIC RUPTURE without other symptoms.,SPONTANEOUS SPLENIC RUPTURE,INFECTIOUS MONONUCLEOSIS
no_relation,causes,0.6575959492214289,"1 ,   11 ,   12  Fetal/Neonatal Morbidity and Mortality  Possible fetal and neonatal morbidity and mortality when BENAZEPRIL is used during PREGNANCY",PREGNANCY,BENAZEPRIL
FLUORINE causes FLUOROSIS,causes,1.0,"Fluoridation of water that contains  Toxicity:  Excess FLUORINE can accumulate in teeth and bones, causing FLUOROSIS",FLUOROSIS,FLUORINE
CONGENITAL CHLORIDORRHEA causes DIARRHEA,causes,0.90913729009699,"Among these causes are receipt of thiazide diuretics, loss of gastric secretions (even in patients with achlorhydria), sweat losses in patients with cystic fibrosis, and DIARRHEA in some patients with villous adenomas or CONGENITAL CHLORIDORRHEA",DIARRHEA,CONGENITAL CHLORIDORRHEA
ACTINOMYCES ISRAELII causes ACTINOMYCOSIS,causes,1.0,Human ACTINOMYCOSIS is primarily caused by  ACTINOMYCES ISRAELII.,ACTINOMYCOSIS,ACTINOMYCES ISRAELII
no_relation,causes,0.8944271909999159,"b ,   c  Fetal/Neonatal Morbidity  Retrospective studies suggest increased risk of congenital malformations in infants of mothers who received anxiolytics (chlordiazepoxide, diazepam, MEPROBAMATE during the FIRST TRIMESTER OF PREGNANCY",FIRST TRIMESTER OF PREGNANCY,MEPROBAMATE
INTERFERON ALFA THERAPY causes AUTOIMMUNE DISEASE,causes,0.881917103688197,"b  Closely monitor, or discontinue INTERFERON ALFA THERAPY in patients who develop an AUTOIMMUNE DISEASE while receiving the drug.",AUTOIMMUNE DISEASE,INTERFERON ALFA THERAPY
DYSMENORRHEA causes PAIN,causes,0.987878339907213,A]  Specific recommendation:  Consider oral contraceptives dosed continuously with active pills to avoid menstruation if DYSMENORRHEA is a predominate feature of PAIN or if symptoms are exacerbated by menses.,PAIN,DYSMENORRHEA
no_relation,causes,0.33333333333333304,"Physical Examination  CUTANEOUS INVOLVEMENT   Flushing, URTICARIA and angioedema have been reported in 88% to 100% of patients experiencing anaphylaxis.",CUTANEOUS INVOLVEMENT,URTICARIA
no_relation,causes,0.768349819927832,"The SKIN affected by the RASH which occurs most often on the vulva, is often thin, shiny, and scarred.",SKIN,RASH
no_relation,causes,0.75, Unlike ACETAZOLAMIDE dexamethasone does not increase the rate of acclimatization but masks the symptoms of AMS resulting in 'rebound' when it is withdrawn,AMS,ACETAZOLAMIDE
PHTHIRUS PUBIS causes PEDICULOSIS PUBIS,causes,0.9878291611472622,"PEDICULOSIS PUBIS which is caused by infestation with  PHTHIRUS PUBIS  [ see Figure 6 ], tends to be limited to the pubic area but occasionally affects the axillae, eyelashes, or other hairy parts of the body.",PEDICULOSIS PUBIS,PHTHIRUS PUBIS
RESPIRATORY SYNCYTIAL VIRUSES causes COLDS,causes,1.0,"ETIOLOGY: Most COLDS are caused by rhinoviruses, adenoviruses, coronaviruses, coxsackieviruses, influenza viruses, parainfluenza viruses, or RESPIRATORY SYNCYTIAL VIRUSES",COLDS,RESPIRATORY SYNCYTIAL VIRUSES
TROPICAL PULMONARY EOSINOPHILIA causes EOSINOPHILIA,causes,1.0,"TROPICAL PULMONARY EOSINOPHILIA (TPE)  is an uncommon manifestation with recurrent bronchospasm, transitory lung infiltrates, low grade fever, and marked EOSINOPHILIA",EOSINOPHILIA,TROPICAL PULMONARY EOSINOPHILIA
no_relation,causes,0.4200840252084029,"The dentist must ensure a correct diagnosis does not mistake TN as a temporomandibular disorder.[17] Since triggering may be caused by movements of the tongue or facial muscles, TN must be differentiated from MASTICATORY PAIN that has the clinical characteristics of deep somatic rather than neuropathic pain.",MASTICATORY PAIN,TN
HAEMOPHILUS DUCREYI causes CHANCROID,causes,0.99654575824488,137  Chancroid  Treatment of CHANCROID caused by  HAEMOPHILUS DUCREYI.,CHANCROID,HAEMOPHILUS DUCREYI
MITRAL VALVE PROLAPSE causes MARFAN SYNDROME,causes,0.445435403187374,MITRAL VALVE PROLAPSE is usually an isolated abnormality but may cause some degree of mitral regurgitation or be accompanied by MARFAN SYNDROME or an atrial septal defect.,MITRAL VALVE PROLAPSE,MARFAN SYNDROME
HUS causes MICROANGIOPATHIC HEMOLYSIS,causes,0.787838597158335,"MICROANGIOPATHIC HEMOLYSIS neutrophilic leukocytosis, and a negative direct Coombs test (direct antiglobulin test) strongly suggest TTP or HUS",MICROANGIOPATHIC HEMOLYSIS,HUS
PV causes HEMORRHAGE,causes,0.828517156108491,Evidence:  Several studies documented the increased blood viscosity associated with high hematocrit levels in PV and the subsequent increased risk of thrombosis and HEMORRHAGE ( 29 ;  30 ;  31.,HEMORRHAGE,PV
PROGRESSIVE SUPRANUCLEAR PALSY causes PROGRESSIVE AXIAL DYSTONIA,causes,0.9878291611472622,"PROGRESSIVE SUPRANUCLEAR PALSY  (Steele Richardson Olszewski Syndrome)  PROGRESSIVE SUPRANUCLEAR PALSY is a rare, degenerative CNS disorder causing loss of voluntary eye movements, bradykinesia, muscular rigidity with PROGRESSIVE AXIAL DYSTONIA pseudobulbar palsy, and dementia.",PROGRESSIVE AXIAL DYSTONIA,PROGRESSIVE SUPRANUCLEAR PALSY
no_relation,causes,0.917662935482247,"Main article: INAPPROPRIATE SINUS TACHYCARDIA [edit] Postural orthostatic tachycardia syndrome (POTS)  Usually in women with no heart problems, this syndrome is characterized by normal resting heart rate but exaggerated POSTURAL SINUS TACHYCARDIA with or without orthostatic hypotension.",POSTURAL SINUS TACHYCARDIA,INAPPROPRIATE SINUS TACHYCARDIA
YELLOW FEVER VIRUS causes FULMINANT YELLOW FEVER,causes,0.99654575824488,101  Vaccine associated viscerotropic disease resembles FULMINANT YELLOW FEVER caused by wild type YELLOW FEVER VIRUS,FULMINANT YELLOW FEVER,YELLOW FEVER VIRUS
no_relation,causes,0.792593923901217,"Also, some research shows people with NPS are more prone to glaucoma and SCOLIOSIS due to poorly developed spines.",SCOLIOSIS,NPS
BORRELIA RECURRENTIS causes RELAPSING FEVER,causes,0.99654575824488,"d ,   e  Relapsing Fever  Treatment of RELAPSING FEVER caused by  BORRELIA RECURRENTIS.",RELAPSING FEVER,BORRELIA RECURRENTIS
TOXOPLASMA GONDII causes CONGENITAL TOXOPLASMOSIS,causes,1.0,CONGENITAL TOXOPLASMOSIS is caused by transplacental acquisition of  TOXOPLASMA GONDII,CONGENITAL TOXOPLASMOSIS,TOXOPLASMA GONDII
no_relation,causes,0.5656854249492379,"Severe THROMBOCYTOPENIA may occur, however; IDIOPATHIC THROMBOCYTOPENIC PURPURA (ITP) may be an initial presentation of SLE.",THROMBOCYTOPENIA,IDIOPATHIC THROMBOCYTOPENIC PURPURA
ENDOMETRIOSIS causes PAIN,causes,1.0,"In three large studies of women with chronic pelvic pain, ENDOMETRIOSIS was found to be the cause of the PAIN in 70 to 80% of cases.",PAIN,ENDOMETRIOSIS
PHEOCHROMOCYTOMA causes HYPERTENSION,causes,0.9918365981341758,b  Diazoxide is ineffective in the management of HYPERTENSION caused by PHEOCHROMOCYTOMA,HYPERTENSION,PHEOCHROMOCYTOMA
B ANTHRACIS causes ANTHRAX,causes,0.99654575824488,ANTHRAX caused by B ANTHRACIS has gained new importance as a potential bioterrorism weapon after the 2001 attacks.,ANTHRAX,B ANTHRACIS
no_relation,causes,0.393919298579168,"BC]  Specific recommendation:  Consider underlying SLE mixed connective tissue disease, RHEUMATOID ARTHRITIS and other collagen vascular diseases as possible causes of pleuritic chest pain.",RHEUMATOID ARTHRITIS,SLE
no_relation,causes,0.824163383692134,PREDOMINANTLY CUTANEOUS VASCULITIS  (Leukocytoclastic Vasculitis; Hypersensitivity Vasculitis)  Primarily cutaneous vasculitis is VASCULITIS that affects mainly small CUTANEOUS VESSELS causing skin lesions.,CUTANEOUS VESSELS,VASCULITIS
CLUSTER HEADACHES causes PERIORBITAL OR TEMPORAL PAIN,causes,1.0,"CLUSTER HEADACHE  CLUSTER HEADACHES cause excruciating, unilateral PERIORBITAL OR TEMPORAL PAIN with ipsilateral autonomic symptoms (ptosis, lacrimation, rhinorrhea, nasal congestion.",PERIORBITAL OR TEMPORAL PAIN,CLUSTER HEADACHES
BONE METASTASES causes PATHOLOGIC FRACTURES,causes,0.9931270663228408,BONE METASTASES cause severe pain and PATHOLOGIC FRACTURES,PATHOLOGIC FRACTURES,BONE METASTASES
GALACTOSEMIA causes CATARACTS,causes,0.9950371902099888,"2.3 Recognize that certain metabolic diseases, such as GALACTOSEMIA diabetes, and genetic aberrations, can cause CATARACTS in the neonatal period and early childhood.",CATARACTS,GALACTOSEMIA
no_relation,causes,0.474712663277541,These patients tend to have persistent TACHYCARDIAS that have been referred to as the permanent form of JUNCTIONAL TACHYCARDIA (PJRT.,TACHYCARDIAS,JUNCTIONAL TACHYCARDIA
no_relation,causes,0.7293249574894731,"About 35% of Crohn's disease cases involve the ileum alone (ileitis); about 45% involve the ileum and colon (ileocolitis), with a predilection for the right side of the colon; and about 20% involve the COLON alone (GRANULOMATOUS COLITIS most of which, unlike ulcerative colitis (UC), spare the rectum.",COLON,(GRANULOMATOUS COLITIS
BURKHOLDERIA MALLEI causes GLANDERS,causes,0.9838699100999068,114  Burkholderia Infections  Treatment of GLANDERS   +    caused by  BURKHOLDERIA MALLEI,GLANDERS,BURKHOLDERIA MALLEI
INTERRUPTED URINARY STREAM BLADDER CARCINOMA causes INTERMITTENT PAINLESS HEMATURIA,causes,0.986393923832143,Patients may have dysuria and suprapubic pain that radiates to the tip of the penis and an INTERRUPTED URINARY STREAM BLADDER CARCINOMA  Usually presents as INTERMITTENT PAINLESS HEMATURIA,INTERMITTENT PAINLESS HEMATURIA,INTERRUPTED URINARY STREAM BLADDER CARCINOMA
BRUCELLOSIS causes BRUCELLA MELITENSIS,causes,0.913811548620257,Treatment of BRUCELLOSIS   +    caused by  BRUCELLA MELITENSIS.,BRUCELLOSIS,BRUCELLA MELITENSIS
FUNGI causes TINEA UNGUIUM,causes,0.985527456652574,"Treatment of dermatophyte infections of the toenail or fingernail (onychomycosis, TINEA UNGUIUM caused by susceptible FUNGI",TINEA UNGUIUM,FUNGI
FABRY DISEASE causes NEPHRITIC RENAL FAILURE,causes,0.9090909090909092,"41   In men (homozygotes), FABRY DISEASE often progresses to NEPHRITIC RENAL FAILURE stroke, and cardiomyopathy.",NEPHRITIC RENAL FAILURE,FABRY DISEASE
TRICHOSPORON BEIGELII causes WHITE PIEDRA,causes,1.0,"piedra    (            audio )  [Sp., stone] Sheathlike nodular masses in the hair of the beard and mustache from growth of either  Piedraia hortai,  which causes black piedra, or  TRICHOSPORON BEIGELII  which causes WHITE PIEDRA",WHITE PIEDRA,TRICHOSPORON BEIGELII
no_relation,causes,0.905821627315676,"SEPTO OPTIC DYSPLASIA    A rare developmental disorder of the brain and eye in which the OPTIC DISK AND SEPTUM PELLUCIDUM do not develop normally, resulting in blindness, hormonal deficiencies, learning disabilities, decreased muscular tone, and, occasionally, seizures.",OPTIC DISK AND SEPTUM PELLUCIDUM,SEPTO OPTIC DYSPLASIA
PENICILLAMINE causes MEMBRANOUS NEPHROPATHY,causes,1.0,"Gold, PENICILLAMINE NSAIDs, and mercury have been shown to cause MEMBRANOUS NEPHROPATHY",MEMBRANOUS NEPHROPATHY,PENICILLAMINE
EPIDERMAL NEVUS SYNDROME causes SEIZURES,causes,0.979957887012223,"EPIDERMAL NEVUS SYNDROME  The EPIDERMAL NEVUS SYNDROME is characterized by systemic manifestations, such as SEIZURES mental retardation, blindness, and skeletal abnormalities in association with large epidermal nevi.",SEIZURES,EPIDERMAL NEVUS SYNDROME
FM causes PAIN,causes,0.981980506061966,"PATHOPHYSIOLOGY  Enormous progress in our understanding of the pathophysiologic underpinnings of PAIN fatigue, and other symptoms in FM has been made in the last few years.",PAIN,FM
no_relation,causes,0.679366220486757,"41   However, those who develop varicella or HERPES ZOSTER  after  transplantation should be considered immune to VARICELLA",VARICELLA,HERPES ZOSTER
no_relation,causes,0.5714285714285711,"SYSTEMIC MASTOCYTOSIS most commonly occurs in adults and is characterized by multifocal bone marrow lesions; it often involves other organs, most commonly SKIN LYMPH NODES LIVER spleen, or GI tract.",SKIN LYMPH NODES LIVER,SYSTEMIC MASTOCYTOSIS
TREPONEMA PERTENUE causes YAWS,causes,0.9284766908852592,g  Yaws  Alternative to penicillin G for treatment of YAWS caused by  TREPONEMA PERTENUE.,YAWS,TREPONEMA PERTENUE
no_relation,causes,0.384110639798688,"Because thalidomide is a known human teratogen and can cause severe, life threatening birth defects if administered during PREGNANCY commercially available THALIDOMIDE must be obtained through a restricted distribution program, the System for Thalidomide Education and Prescribing Safety (STEPS), designed to help ensure that fetal exposure to the drug does not occur.",PREGNANCY,THALIDOMIDE
 WILSON'S DISEASE causes ACUTE HEPATIC FAILURE,causes,0.98058067569092, WILSON'S DISEASE may present as acute hepatic injury or ACUTE HEPATIC FAILURE,ACUTE HEPATIC FAILURE, WILSON'S DISEASE
no_relation,causes,0.635000635000953,"Large ambient pressure changes or strenuous activities, such as weight lifting, can induce a PERILYMPHATIC FISTULA between the MIDDLE AND INNER EAR",MIDDLE AND INNER EAR,PERILYMPHATIC FISTULA
NEISSERIA GONORRHOEAE causes GONORRHEA,causes,0.98058067569092,"c ,   116  Gonorrhea and Associated Infections  Alternative for treatment of uncomplicated GONORRHEA (including urethritis) caused by susceptible  NEISSERIA GONORRHOEAE",GONORRHEA,NEISSERIA GONORRHOEAE
OLIGODENDROGLIOMAS causes HEMORRHAGE,causes,0.552344770738994,HEMORRHAGE is more likely to occur with OLIGODENDROGLIOMAS than with astrocytomas.,HEMORRHAGE,OLIGODENDROGLIOMAS
no_relation,causes,0.9901475429766742,Economic impact of PNEUMONIA due to RESPIRATORY SYNCYTIAL VIRUS (RSV) infection.,PNEUMONIA,RESPIRATORY SYNCYTIAL VIRUS
NOCARDIA causes NOCARDIA INFECTIONS,causes,0.768221279597376,"121  NOCARDIA INFECTIONS  Treatment of infections caused by  NOCARDIA    +   , including  N. asteroides, N. brasiliensis , and  N. caviae.",NOCARDIA INFECTIONS,NOCARDIA
no_relation,causes,0.321633760451338,"RESPIRATORY VIRAL INFECTIONS are a leading cause of morbidity, hospitalization, and mortality throughout the world; INFLUENZA and pneumonia were the most prevalent infectious causes of death during the 20th century in the United States.",INFLUENZA,RESPIRATORY VIRAL INFECTIONS
LISTERIA MONOCYTOGENES causes LISTERIA INFECTIONS,causes,0.8834522085987719,11  LISTERIA INFECTIONS  Treatment of infections caused by  LISTERIA MONOCYTOGENES ; used alone or in conjunction with an aminoglycoside.,LISTERIA INFECTIONS,LISTERIA MONOCYTOGENES
no_relation,causes,0.329292779969071,"However, zinc in combination with vitamin A reduced the prevalence of persistent diarrhea (DIARRHEA lasting  14 d) (rate ratio 0.79, CI 0.66 to 0.94) and DYSENTERY (blood and mucus in stools) (rate ratio 0.80, CI 0.67 to 0.95.",DIARRHEA,DYSENTERY
ANTIBIOTIC ASSOCIATED DIARRHEA AND COLITIS causes MILD DIARRHEA TO FATAL COLITIS,causes,0.8660254037844392,"100 ,   101 ,   102 ,   103 ,   104 ,   105    C. difficile  associated diarrhea and colitis (CDAD; also known as ANTIBIOTIC ASSOCIATED DIARRHEA AND COLITIS or pseudomembranous colitis) has been reported with nearly all anti infectives, including lincomycin, and may range in severity from MILD DIARRHEA TO FATAL COLITIS.",MILD DIARRHEA TO FATAL COLITIS,ANTIBIOTIC ASSOCIATED DIARRHEA AND COLITIS
FIBROMYALGIA causes GENERALIZED PAIN AND TENDERNESS,causes,0.979957887012223,FIBROMYALGIA is suspected in patients with GENERALIZED PAIN AND TENDERNESS especially disproportionate to the physical findings; with negative laboratory results despite widespread symptoms; or when fatigue is the predominant symptom.,GENERALIZED PAIN AND TENDERNESS,FIBROMYALGIA
VULVODYNIA causes PAIN,causes,0.744208407535251,"The applied mass per area (kg/cm 2 ) that will elicit a complaint of pain in subjects with PAINful conditions, e.g., fibromyalgia, temperomandibular joint dysfunction, or VULVODYNIA",PAIN,VULVODYNIA
C PSITTACI causes PSITTACOSIS,causes,0.975900072948533,Treatment of PSITTACOSIS (ornithosis) caused by  C PSITTACI,PSITTACOSIS,C PSITTACI
UNSTABLE ANGINA causes PAIN,causes,0.843274042711568,"Symptoms of UNSTABLE ANGINA or infarction, ischemic stroke, or rest PAIN in the limbs may develop when unstable plaques rupture and acutely occlude a major artery, with superimposition of thrombosis or embolism.",PAIN,UNSTABLE ANGINA
no_relation,causes,0.7559289460184542,"COMMENTARY  In a very diverse group of patients, with equally diverse risks for seizure recurrence, Marson and colleagues compared early and deferred AED treatment after a first SEIZURE or an early diagnosis of EPILEPSY",SEIZURE,EPILEPSY
no_relation,causes,0.5252257314388901,100   Advise patients that PODOPHYLLUM RESIN is not a cure for HPV; new HPV WARTS may develop during or after therapy with the drug.,WARTS,PODOPHYLLUM RESIN
HEPATITIS C INFECTION causes HEPATITIS C,causes,0.4472135954999579,"Because concurrent HEPATITIS C INFECTION is common and may be asymptomatic, serum markers for HEPATITIS C (see    ) should be obtained.",HEPATITIS C INFECTION,HEPATITIS C
EPSTEIN BARR VIRUS  EBV causes MONONUCLEOSIS,causes,1.0,41  EPSTEIN BARR VIRUS  EBV causes infectious MONONUCLEOSIS and has been implicated as a cause of nasopharyngeal carcinoma and Burkitt lymphoma.,MONONUCLEOSIS,EPSTEIN BARR VIRUS  EBV
no_relation,causes,0.304603849540086,"A randomized, double blind, placebo controlled trial  Failure of DOXYCYCLINE as a causal prophylactic agent against PLASMODIUM FALCIPARUM MALARIA in healthy nonimmune volunteers  Primaquine prophylaxis against malaria in nonimmune Colombian soldiers: efficacy and toxicity.",PLASMODIUM FALCIPARUM MALARIA,DOXYCYCLINE
GALACTOSEMIA causes EARLY CATARACT FORMATION,causes,0.875189948987367, EARLY CATARACT FORMATION in GALACTOSEMIA can be reversed by early diagnosis and dietary intervention.,EARLY CATARACT FORMATION,GALACTOSEMIA
no_relation,causes,0.666666666666667,"For almost all patients with PSVT, the underlying mechanism of the tachycardia is atrioventricular NODE REENTRY (AVNRT REENTRY) involving an accessory pathway (AVRT), or atrial TACHYCARDIA.",TACHYCARDIA,NODE REENTRY (AVNRT REENTRY)
no_relation,causes,0.845154254728516,"Treatment  To simplify therapy, SLE should be classified as mild (eg, fever, arthritis, pleurisy, PERICARDITIS headache, rash) or severe (eg, hemolytic anemia, thrombocytopenic purpura, massive pleural and pericardial involvement, significant renal damage, acute vasculitis of the extremities or GI tract, florid CNS involvement.",PERICARDITIS,SLE
COXIELLA BURNETII causes Q FEVER,causes,0.961074462327142,Q Fever  Treatment of Q FEVER endocarditis   +    caused by  COXIELLA BURNETII ; used in conjunction with doxycycline.,Q FEVER,COXIELLA BURNETII
BENIGN JUVENILE MELANOMA causes PAPULE,causes,0.9901475429766742,"Formerly called BENIGN JUVENILE MELANOMA spindle cell nevus usually arises in childhood as a pink or reddish brown, smooth or slightly scaly, firm PAPULE with a predilection for the face, especially the cheeks [ see  Figure 13.",PAPULE,BENIGN JUVENILE MELANOMA
ENDOMETRIOSIS causes PELVIC PAIN,causes,0.9594032236002472, Note that the differential diagnosis and work up may be slightly different for a patient with suspected endometriosis and primarily PELVIC PAIN than for a patient with suspected ENDOMETRIOSIS and primarily fertility concerns.,PELVIC PAIN,ENDOMETRIOSIS
KLIPPEL TRENAUNAY WEBER SYNDROME causes CONGENITAL ARTERIOVENOUS FISTULAS,causes,0.5625439504630121,"Rarely, varicose veins are part of KLIPPEL TRENAUNAY WEBER SYNDROME which includes CONGENITAL ARTERIOVENOUS FISTULAS and diffuse cutaneous capillary angiomas.",CONGENITAL ARTERIOVENOUS FISTULAS,KLIPPEL TRENAUNAY WEBER SYNDROME
MYOCARDIAL INFARCTION causes CARVEDILOL REDUCED MORTALITY,causes,0.9830783046228492,CARVEDILOL REDUCED MORTALITY and morbidity caused by myocardial infarction in patients with left ventricular dysfunction  Keywords: MYOCARDIAL INFARCTION Left ventricular function Adrenergic beta agonists  ACP Journal Club.,MYOCARDIAL INFARCTION,CARVEDILOL REDUCED MORTALITY
PURE 'SMALL FIBER' POLYNEUROPATHIES causes AUTONOMIC NERVOUS SYSTEM DYSFUNCTION,causes,0.9615239476408228,Tendon reflexes are depressed more frequently in demyelinating or large fiber polyneuropathies and are not depressed in PURE 'SMALL FIBER' POLYNEUROPATHIES Physical exam  Autonomic dysfunction         Signs of AUTONOMIC NERVOUS SYSTEM DYSFUNCTION may be seen in polyneuropathy if autonomic fibers are involved,AUTONOMIC NERVOUS SYSTEM DYSFUNCTION,PURE 'SMALL FIBER' POLYNEUROPATHIES
FRANCISELLA TULARENSIS causes TULAREMIA,causes,0.9931270663228408,"SYN:   Treacher Collins syndrome    FRANCISELLA TULARENSIS    (                                audio )  [Edward Francis, Tulare County, California] A gram negative, aerobic, non spore forming bacillus that causes TULAREMIA in humans and animals.",TULAREMIA,FRANCISELLA TULARENSIS
no_relation,causes,0.9113223768657672,Specific recommendation:  Distinguish SEPSIS from other causes of SIRS,SIRS,SEPSIS
CPPD DISEASE causes SWOLLEN JOINT,causes,0.768221279597376," Consider aspirating a SWOLLEN JOINT to document the presence of CPPD crystals or document an arthritic process other than CPPD DISEASE e.g., septic arthritis or gout.",SWOLLEN JOINT,CPPD DISEASE
no_relation,causes,0.7330166661378309,"Early treatment, when the HEADACHE is mild, is much more effective than later treatment, when the MIGRAINE is moderate or severe in intensity.",HEADACHE,MIGRAINE
MYCOBACTERIUM TUBERCULOSIS causes NONCAVITY PULMONARY TB,causes,0.997054485501582,"14  ATS, CDC, and IDSA state that rifapentine can be used in conjunction with isoniazid in the continuation phase in HIV seronegative patients with NONCAVITY PULMONARY TB caused by susceptible  MYCOBACTERIUM TUBERCULOSIS ; rifapentine is an alternative to rifampin for use in conjunction with isoniazid in the continuation phase.",NONCAVITY PULMONARY TB,MYCOBACTERIUM TUBERCULOSIS
RICKETTSIA RICKETTSII causes ROCKY MOUNTAIN SPOTTED FEVER,causes,0.997054485501582,"Included are infections caused by the pathogenic organism  RICKETTSIA RICKETTSII , which causes ROCKY MOUNTAIN SPOTTED FEVER",ROCKY MOUNTAIN SPOTTED FEVER,RICKETTSIA RICKETTSII
no_relation,causes,0.896258159530272,69  EBV INFECTION in the Immunocompromised Host  Immunocompromised hosts are susceptible to overwhelming EBV LYMPHOPROLIFERATIVE SYNDROMES.,EBV INFECTION,EBV LYMPHOPROLIFERATIVE SYNDROMES
no_relation,causes,0.625,This disorder is termed KALLMANN SYNDROME when it is accompanied by ANOSMIA and has also been termed idiopathic hypogonadotropic hypogonadism (IHH.,ANOSMIA,KALLMANN SYNDROME
INFECTIOUS MONONUCLEOSIS causes LYMPHADENOPATHY,causes,0.997054485501582,"INFECTIOUS MONONUCLEOSIS  Clinical features   Patients usually present with fever, pharyngitis, and LYMPHADENOPATHY",LYMPHADENOPATHY,INFECTIOUS MONONUCLEOSIS
no_relation,causes,0.953462589245592," Clinical spells and HYPERTENSION from circulating catecholamines are insufficiently sensitive to be used as primary indicators of PHEOCHROMOCYTOMAS but, when present, may herald life threatening crises.",HYPERTENSION,PHEOCHROMOCYTOMAS
ACUTE ARTERITIS WITH EOSINOPHILIA causes HYPEREOSINOPHILIC SYNDROME,causes,0.9237604307034007,"Loffler's syndrome (a subcategory of HYPEREOSINOPHILIC SYNDROME with primary cardiac involvement), which occurs in the tropics, begins as an ACUTE ARTERITIS WITH EOSINOPHILIA followed by thrombus formation on the endocardium, chordae, and atrioventricular (AV) valves, progressing to fibrosis.",ACUTE ARTERITIS WITH EOSINOPHILIA,HYPEREOSINOPHILIC SYNDROME
CHRONIC PAIN FROM BRACHIAL PLEXUS causes RSD,causes,0.9237604307034007,"CHRONIC PAIN FROM BRACHIAL PLEXUS injury becomes RSD once additional, RSD defining symptoms develop.",CHRONIC PAIN FROM BRACHIAL PLEXUS,RSD
ECLAMPSIA causes COMPLICATION,causes,0.5,ECLAMPSIA is the most serious COMPLICATION of pregnancy induced hypertension (PIH.,COMPLICATION,ECLAMPSIA
ELEVATED INTRACRANIAL PRESSURE causes PAPILLEDEMA,causes,0.970142500145332,PAPILLEDEMA is a sign of ELEVATED INTRACRANIAL PRESSURE and is almost always bilateral.,PAPILLEDEMA,ELEVATED INTRACRANIAL PRESSURE
no_relation,causes,0.6575959492214289, Often has characteristic ECG patterns that facilitate diagnosis  Avoid ICD placement in patients with Wolff Parkinson White syndrome with REGULAR WIDE COMPLEX TACHYCARDIA (a supraventricular arrhythmia resembling VT which should be treated with drug therapy or catheter ablation.,REGULAR WIDE COMPLEX TACHYCARDIA,VT
LEPTOSPIRA INTERROGANS causes LEPTOSPIROSIS,causes,0.9901475429766742,"physician, 1848 1916] LEPTOSPIROSIS caused by any one of several serotypes of  LEPTOSPIRA INTERROGANS  such as  L. icterohemorrhagica  in rats,  L. pomona  in swine, or  L. canicola  in dogs.",LEPTOSPIROSIS,LEPTOSPIRA INTERROGANS
no_relation,causes,0.5669467095138411," Systematic reviews of treatment modalities for osteoarthritis ( 28 ;  29 ), rheumatoid arthritis ( 30 ;  31 ;  32 ;  33 ), FIBROMYALGIA ( 34 ), and LOW BACK PAIN ( 35 ;  36 ;  37 ) confirm that each of these specific pain syndromes responds to specific treatment modalities and that accurate diagnosis is important to guide optimal pain management.",LOW BACK PAIN,FIBROMYALGIA
